{
  "$schema": "https://json-schema.org/draft/2020-12/schema",
  "$id": "TestCaseDraft.schema.json",
  "title": "TestCaseDraftBatch",
  "type": "object",
  "required": [
    "schema_version",
    "run_id",
    "product_id",
    "generated_at",
    "golden_version",
    "golden_sampling",
    "golden_references",
    "source_requirement_keys",
    "coverage_report",
    "tests"
  ],
  "properties": {
    "schema_version": {
      "type": "string",
      "const": "1.0"
    },
    "run_id": {
      "type": "string",
      "minLength": 1
    },
    "generated_at": {
      "type": "string",
      "format": "date-time"
    },
    "golden_version": {
      "type": "string",
      "minLength": 1
    },
    "source_requirement_keys": {
      "type": "array",
      "items": {
        "type": "string",
        "pattern": "^[A-Z][A-Z0-9]+-[0-9]+$"
      },
      "minItems": 1
    },
    "requirements_review_run_id": {
      "type": "string",
      "description": "Optional link to requirements-review artifact"
    },
    "gate_override": {
      "type": "boolean",
      "description": "True if force=true was used to bypass BLOCKED review gate"
    },
    "suite_mode": {
      "type": "string",
      "enum": ["release_slice_e2e", "comprehensive_legacy"],
      "description": "release_slice_e2e is journey-only. The count comes from coverage_profile when that object is present; otherwise 3-5."
    },
    "coverage_profile": {
      "type": "object",
      "description": "Coverage depth selected in Studio. actual_count must be <= test_count_max. Fewer tests are valid when the requirement cannot support the minimum.",
      "required": ["id", "test_count_min", "test_count_max", "actual_count"],
      "additionalProperties": false,
      "properties": {
        "id": {
          "type": "string",
          "enum": ["smoke", "core", "balanced", "thorough", "edge"]
        },
        "test_count_min": { "type": "integer", "minimum": 1 },
        "test_count_max": { "type": "integer", "minimum": 1 },
        "actual_count": { "type": "integer", "minimum": 0 },
        "omitted": {
          "type": "array",
          "items": { "type": "string" }
        }
      }
    },
    "product_id": {
      "type": "string",
      "description": "Resolved config product id e.g. bigpicture"
    },
    "pipeline_run_id": {
      "type": "string",
      "description": "Stable Studio Reviewer run id copied from handoff when available"
    },
    "golden_root": {
      "type": "string",
      "description": "Path used for style/depth reference (from config or override)"
    },
    "golden_sampling": {
      "type": "object",
      "description": "CR-GOLDEN-01: auditable random draw of 5-10 golden tests before draft",
      "required": [
        "method",
        "sample_count",
        "candidate_pool_size",
        "similarity_count",
        "random_fill_count"
      ],
      "properties": {
        "method": {
          "type": "string",
          "enum": ["similarity", "similarity_with_random_fill", "random"]
        },
        "sample_count": { "type": "integer", "minimum": 5, "maximum": 10 },
        "candidate_pool_size": { "type": "integer", "minimum": 5 },
        "similarity_pool_size": {
          "type": "integer",
          "minimum": 0,
          "description": "Tests in extract with similarity score > 0"
        },
        "similarity_count": {
          "type": "integer",
          "minimum": 0,
          "maximum": 10,
          "description": "How many references were chosen by theme similarity"
        },
        "random_fill_count": {
          "type": "integer",
          "minimum": 0,
          "maximum": 10,
          "description": "Keys added by random draw when similar pool < sample_count"
        },
        "random_seed": {
          "type": "string",
          "minLength": 1,
          "description": "Required when random_fill_count > 0 or method is random"
        },
        "keywords": {
          "type": "array",
          "items": { "type": "string" },
          "description": "Epic theme keywords used for ranking"
        },
        "pool_note": { "type": "string" }
      },
      "additionalProperties": false
    },
    "golden_references": {
      "type": "array",
      "minItems": 5,
      "maxItems": 10,
      "description": "CR-GOLDEN-01: production golden tests read as writing reference before draft",
      "items": {
        "type": "object",
        "required": ["jira_key", "path", "why_selected", "style_cues_applied"],
        "properties": {
          "jira_key": {
            "type": "string",
            "pattern": "^TC-[0-9]+$",
            "description": "Golden test key from Xray extract, or use TC-0000 only for v1 markdown examples"
          },
          "path": { "type": "string", "minLength": 1 },
          "why_selected": { "type": "string", "minLength": 1 },
          "style_cues_applied": {
            "type": "array",
            "items": { "type": "string", "minLength": 1 },
            "minItems": 1
          }
        },
        "additionalProperties": false
      }
    },
    "review_ref": {
      "type": "string",
      "description": "Path to approved review-payload.json when Reviewer handoff was used"
    },
    "persona_files": {
      "type": "array",
      "items": { "type": "string" },
      "description": "Trinity/personas/ files loaded for this run"
    },
    "execution_plan": {
      "$ref": "#/$defs/execution_plan"
    },
    "coverage_report": {
      "$ref": "#/$defs/coverage_report"
    },
    "tests": {
      "type": "array",
      "items": {
        "$ref": "#/$defs/test_case_draft"
      },
      "minItems": 1
    },
    "validation": {
      "type": "object",
      "properties": {
        "schema_valid": { "type": "boolean" },
        "traceability_valid": { "type": "boolean" },
        "policy_valid": { "type": "boolean" },
        "errors": {
          "type": "array",
          "items": { "type": "string" }
        }
      }
    }
  },
  "$defs": {
    "test_case_draft": {
      "type": "object",
      "required": [
        "title",
        "linked_requirement_keys",
        "steps",
        "execution_tier",
        "priority",
        "priority_score",
        "test_pattern",
        "role",
        "customer_impact",
        "test_data_required",
        "test_data_prerequisites",
        "automation_fit",
        "automation_candidate",
        "automation_blockers",
        "persona_notes"
      ],
      "properties": {
        "draft_id": {
          "type": "string",
          "description": "Stable id within batch e.g. TC-001"
        },
        "title": {
          "type": "string",
          "minLength": 8
        },
        "linked_requirement_keys": {
          "type": "array",
          "items": {
            "type": "string",
            "pattern": "^[A-Z][A-Z0-9]+-[0-9]+$"
          },
          "minItems": 1
        },
        "coverage_catalog_id": {
          "type": "string",
          "description": "Optional; product catalog id when assets.coverage_catalog is set",
          "pattern": "^CAT-[A-Z0-9-]+$"
        },
        "automation_fit": {
          "type": "string",
          "enum": ["full", "partial", "manual_only"],
          "description": "Automation suitability for regression backlog"
        },
        "automation_candidate": {
          "type": "boolean",
          "description": "True when full or partial happy path should enter automation backlog"
        },
        "automation_blockers": {
          "type": "array",
          "items": { "type": "string", "minLength": 1 },
          "description": "Empty when automation_fit is full"
        },
        "persona_notes": {
          "type": "object",
          "required": ["qa_engineer", "test_architect", "automation_engineer"],
          "properties": {
            "qa_engineer": { "type": "string", "minLength": 1 },
            "test_architect": { "type": "string", "minLength": 1 },
            "automation_engineer": { "type": "string", "minLength": 1 }
          },
          "additionalProperties": false
        },
        "execution_tier": {
          "type": "string",
          "enum": ["P0", "P1", "P2", "P3"],
          "description": "Derived from priority_score.total: P0=13–15, P1=10–12, P2=7–9, P3=3–6"
        },
        "test_pattern": {
          "type": "string",
          "enum": ["journey", "atomic"]
        },
        "role": {
          "type": "string",
          "description": "OKR_ADMIN, STANDARD_USER, NO_PERMISSION, API_CLIENT, SYSTEM"
        },
        "customer_impact": {
          "type": "string",
          "minLength": 10,
          "description": "One sentence: who is harmed and how if this test fails"
        },
        "deferrable": {
          "type": "boolean",
          "description": "True if safe to skip under time pressure (required true for P3)"
        },
        "deferrable_rationale": {
          "type": "string",
          "description": "Why skipping is acceptable; required when deferrable=true"
        },
        "test_data_required": {
          "type": "boolean",
          "description": "True if domain test data must exist before executing step 1 (fields, OKRs, users, files). False if test creates all data during execution (environment-only setup)."
        },
        "test_data_prerequisites": {
          "type": "string",
          "minLength": 1,
          "description": "What to prepare before the test. If test_data_required=false, list environment-only needs (account, empty box, flag state)."
        },
        "objective": { "type": "string" },
        "preconditions": { "type": "string" },
        "test_type": {
          "type": "string",
          "enum": ["Manual", "Cucumber", "Generic", "Other"],
          "default": "Manual"
        },
        "priority": {
          "type": "string",
          "enum": ["Highest", "High", "Medium", "Low"],
          "description": "Canonical Xray/Jira mapping: P0=Highest, P1=High, P2=Medium, P3=Low"
        },
        "priority_score": {
          "$ref": "#/$defs/priority_score"
        },
        "steps": {
          "type": "array",
          "minItems": 1,
          "items": {
            "type": "object",
            "required": ["step", "expected_result"],
            "properties": {
              "step": { "type": "string", "minLength": 1 },
              "expected_result": { "type": "string", "minLength": 1 },
              "test_data": { "type": "string" }
            }
          }
        },
        "tags": {
          "type": "array",
          "items": { "type": "string" }
        },
        "covers_design": { "type": "boolean" },
        "design_references": {
          "type": "array",
          "items": { "type": "string", "format": "uri" }
        },
        "linked_ac_ids": {
          "type": "array",
          "items": { "type": "string" },
          "description": "Optional traceability to requirement AC ids"
        },
        "source_quotes": {
          "type": "array",
          "items": { "type": "string" },
          "description": "Verbatim requirement excerpts grounding this test"
        },
        "golden_reference_keys": {
          "type": "array",
          "items": {
            "type": "string",
            "pattern": "^TC-[0-9]+$"
          },
          "description": "Optional: which golden_references jira_keys this journey most closely follows"
        },
        "generation_notes": { "type": "string" },
        "possible_duplicate_of": {
          "type": "string",
          "description": "Xray test key if dedup search found similar test"
        }
      },
      "allOf": [
        {
          "if": {
            "properties": { "execution_tier": { "const": "P3" } },
            "required": ["execution_tier"]
          },
          "then": {
            "required": ["deferrable", "deferrable_rationale"],
            "properties": {
              "deferrable": { "const": true }
            }
          }
        },
        {
          "if": {
            "properties": { "execution_tier": { "enum": ["P0", "P1"] } },
            "required": ["execution_tier"]
          },
          "then": {
            "properties": {
              "deferrable": { "const": false }
            }
          }
        },
        {
          "if": {
            "properties": { "execution_tier": { "const": "P0" } },
            "required": ["execution_tier"]
          },
          "then": {
            "properties": { "priority": { "const": "Highest" } }
          }
        },
        {
          "if": {
            "properties": { "execution_tier": { "const": "P1" } },
            "required": ["execution_tier"]
          },
          "then": {
            "properties": { "priority": { "const": "High" } }
          }
        },
        {
          "if": {
            "properties": { "execution_tier": { "const": "P2" } },
            "required": ["execution_tier"]
          },
          "then": {
            "properties": { "priority": { "const": "Medium" } }
          }
        },
        {
          "if": {
            "properties": { "execution_tier": { "const": "P3" } },
            "required": ["execution_tier"]
          },
          "then": {
            "properties": { "priority": { "const": "Low" } }
          }
        }
      ]
    },
    "priority_score": {
      "type": "object",
      "description": "CR-SCORE-01: gate score = harm + likelihood + coverage_criticality (3–15)",
      "required": [
        "customer_harm",
        "likelihood",
        "coverage_criticality",
        "automation_value",
        "total",
        "derived_tier",
        "rationale"
      ],
      "additionalProperties": false,
      "properties": {
        "customer_harm": {
          "type": "integer",
          "minimum": 1,
          "maximum": 5,
          "description": "Who is harmed and how badly if this journey fails"
        },
        "likelihood": {
          "type": "integer",
          "minimum": 1,
          "maximum": 5,
          "description": "How likely a regression is (new/changed, complexity, known risk)"
        },
        "coverage_criticality": {
          "type": "integer",
          "minimum": 1,
          "maximum": 5,
          "description": "How central this journey is to Epic ACs / the release gate"
        },
        "automation_value": {
          "type": "integer",
          "minimum": 1,
          "maximum": 5,
          "description": "Regression ROI; does not change execution_tier"
        },
        "total": {
          "type": "integer",
          "minimum": 3,
          "maximum": 15,
          "description": "customer_harm + likelihood + coverage_criticality"
        },
        "derived_tier": {
          "type": "string",
          "enum": ["P0", "P1", "P2", "P3"],
          "description": "Must equal execution_tier: 13–15 P0, 10–12 P1, 7–9 P2, 3–6 P3"
        },
        "rationale": {
          "type": "string",
          "minLength": 1,
          "description": "Why these factor values were chosen"
        }
      }
    },
    "coverage_report": {
      "type": "object",
      "required": ["uncovered_ac_ids", "warnings"],
      "properties": {
        "catalog_coverage_pct": {
          "type": "number",
          "minimum": 0,
          "maximum": 100,
          "description": "Percentage of applicable catalog items Covered or N/A"
        },
        "catalog_coverage": {
          "type": "array",
          "items": {
            "type": "object",
            "required": ["catalog_id", "tier", "status"],
            "properties": {
              "catalog_id": { "type": "string" },
              "tier": { "type": "string", "enum": ["P0", "P1", "P2", "P3"] },
              "covered_by": {
                "type": "array",
                "items": { "type": "string" }
              },
              "status": {
                "type": "string",
                "enum": ["Covered", "UNCOVERED", "PARTIAL", "N/A"]
              },
              "blocker": {
                "type": "string",
                "description": "Why UNCOVERED e.g. API spec TBD"
              }
            }
          }
        },
        "matrix": {
          "type": "array",
          "items": {
            "type": "object",
            "required": ["ac_id", "status"],
            "properties": {
              "jira_key": { "type": "string" },
              "ac_id": { "type": "string" },
              "covered_by": {
                "type": "array",
                "items": { "type": "string" }
              },
              "status": {
                "type": "string",
                "enum": ["Covered", "UNCOVERED", "PARTIAL", "N/A"]
              }
            }
          }
        },
        "uncovered_ac_ids": {
          "type": "array",
          "items": { "type": "string" }
        },
        "uncovered_goals": {
          "type": "array",
          "items": { "type": "string" },
          "description": "Goal bullets from Epic description when formal AC ids absent"
        },
        "warnings": {
          "type": "array",
          "items": { "type": "string" }
        }
      }
    },
    "execution_plan": {
      "type": "object",
      "properties": {
        "p0_critical": { "$ref": "#/$defs/tier_plan" },
        "p1_mandatory": { "$ref": "#/$defs/tier_plan" },
        "p2_medium": { "$ref": "#/$defs/tier_plan" },
        "p3_deferrable": { "$ref": "#/$defs/tier_plan" },
        "minimum_release_gate": { "type": "string" },
        "time_boxed_release": { "type": "string" }
      }
    },
    "tier_plan": {
      "type": "object",
      "properties": {
        "count": { "type": "integer", "minimum": 0 },
        "estimated_hours": { "type": "number", "minimum": 0 },
        "tests": {
          "type": "array",
          "items": { "type": "string" }
        }
      }
    }
  }
}
