{
  "schema_version": "1.0",
  "run_id": "demo-story-suite",
  "generated_at": "2026-10-08T11:00:00+02:00",
  "golden_version": "golden/v2/filter-17844-bigpicture-manual",
  "suite_mode": "release_slice_e2e",
  "product_id": "default",
  "golden_root": "Trinity/creator/golden/v2/filter-17844-bigpicture-manual",
  "golden_sampling": {
    "method": "similarity",
    "sample_count": 10,
    "candidate_pool_size": 245,
    "similarity_pool_size": 51,
    "similarity_count": 10,
    "random_fill_count": 0,
    "random_seed": "demo-story-suite",
    "keywords": [
      "OKR",
      "custom",
      "field",
      "Settings",
      "export",
      "CSV"
    ]
  },
  "golden_references": [
    {
      "jira_key": "TC-6117",
      "path": "Trinity/creator/golden/v2/filter-17844-bigpicture-manual/rag/by-key/TC-6117.json",
      "why_selected": "Theme similarity rank (score 3) to Epic keywords; title: SPM - OKR - Creating Text type custom field",
      "style_cues_applied": [
        "Full JSON read for step depth and BP manual phrasing",
        "Title/navigation pattern from this TC"
      ]
    },
    {
      "jira_key": "TC-6118",
      "path": "Trinity/creator/golden/v2/filter-17844-bigpicture-manual/rag/by-key/TC-6118.json",
      "why_selected": "Theme similarity rank (score 3) to Epic keywords; title: SPM - OKR - Creating Number type custom field",
      "style_cues_applied": [
        "Full JSON read for step depth and BP manual phrasing",
        "Title/navigation pattern from this TC"
      ]
    },
    {
      "jira_key": "TC-6119",
      "path": "Trinity/creator/golden/v2/filter-17844-bigpicture-manual/rag/by-key/TC-6119.json",
      "why_selected": "Theme similarity rank (score 3) to Epic keywords; title: SPM - OKR - Creating Hyperlink type custom field",
      "style_cues_applied": [
        "Full JSON read for step depth and BP manual phrasing",
        "Title/navigation pattern from this TC"
      ]
    },
    {
      "jira_key": "TC-6120",
      "path": "Trinity/creator/golden/v2/filter-17844-bigpicture-manual/rag/by-key/TC-6120.json",
      "why_selected": "Theme similarity rank (score 3) to Epic keywords; title: SPM - OKR - Creating Select type custom field",
      "style_cues_applied": [
        "Full JSON read for step depth and BP manual phrasing",
        "Title/navigation pattern from this TC"
      ]
    },
    {
      "jira_key": "TC-6121",
      "path": "Trinity/creator/golden/v2/filter-17844-bigpicture-manual/rag/by-key/TC-6121.json",
      "why_selected": "Theme similarity rank (score 3) to Epic keywords; title: SPM - OKR - Creating Multi-Select type custom field",
      "style_cues_applied": [
        "Full JSON read for step depth and BP manual phrasing",
        "Title/navigation pattern from this TC"
      ]
    },
    {
      "jira_key": "TC-6122",
      "path": "Trinity/creator/golden/v2/filter-17844-bigpicture-manual/rag/by-key/TC-6122.json",
      "why_selected": "Theme similarity rank (score 3) to Epic keywords; title: SPM - OKR - Creating User type custom field",
      "style_cues_applied": [
        "Full JSON read for step depth and BP manual phrasing",
        "Title/navigation pattern from this TC"
      ]
    },
    {
      "jira_key": "TC-6123",
      "path": "Trinity/creator/golden/v2/filter-17844-bigpicture-manual/rag/by-key/TC-6123.json",
      "why_selected": "Theme similarity rank (score 3) to Epic keywords; title: SPM - OKR - Creating Date type custom field",
      "style_cues_applied": [
        "Full JSON read for step depth and BP manual phrasing",
        "Title/navigation pattern from this TC"
      ]
    },
    {
      "jira_key": "TC-6147",
      "path": "Trinity/creator/golden/v2/filter-17844-bigpicture-manual/rag/by-key/TC-6147.json",
      "why_selected": "Theme similarity rank (score 3) to Epic keywords; title: SPM - OKR - Updating Text custom field values across OKR views",
      "style_cues_applied": [
        "Full JSON read for step depth and BP manual phrasing",
        "Title/navigation pattern from this TC"
      ]
    },
    {
      "jira_key": "TC-6150",
      "path": "Trinity/creator/golden/v2/filter-17844-bigpicture-manual/rag/by-key/TC-6150.json",
      "why_selected": "Theme similarity rank (score 4) to Epic keywords; title: SPM - OKR - Updating custom field name and description in Settings",
      "style_cues_applied": [
        "Full JSON read for step depth and BP manual phrasing",
        "Title/navigation pattern from this TC"
      ]
    },
    {
      "jira_key": "TC-6151",
      "path": "Trinity/creator/golden/v2/filter-17844-bigpicture-manual/rag/by-key/TC-6151.json",
      "why_selected": "Theme similarity rank (score 4) to Epic keywords; title: SPM - OKR - Updating and Deleting Select custom field options in Settings",
      "style_cues_applied": [
        "Full JSON read for step depth and BP manual phrasing",
        "Title/navigation pattern from this TC"
      ]
    }
  ],
  "review_ref": "Trinity/reviewer/samples/demo-epic.payload.json",
  "persona_files": [
    "creator-expert-qa-engineer.md",
    "creator-test-architect.md",
    "creator-expert-test-automation-engineer.md"
  ],
  "source_requirement_keys": [
    "DEMO-4522"
  ],
  "requirements_review_run_id": "2026-09-28-0031",
  "execution_plan": {
    "p0_critical": { "count": 0, "tests": [] },
    "p1_mandatory": { "count": 2, "tests": ["TC-001", "TC-002"] },
    "p2_medium": { "count": 0, "tests": [] },
    "p3_deferrable": { "count": 0, "tests": [] },
    "minimum_release_gate": "Run all P0 and P1 journeys before release.",
    "time_boxed_release": "Skip P3; run P2 only if time remains after P0–P1."
  },
  "coverage_report": {
    "uncovered_ac_ids": [],
    "uncovered_goals": [],
    "warnings": [
      "Sanitized demo batch for Trinity Studio — not a live Jira suite."
    ],
    "matrix": [
      {
        "ac_id": "AC-01",
        "status": "Covered",
        "covered_by": [
          "TC-001"
        ]
      },
      {
        "ac_id": "AC-02",
        "status": "Covered",
        "covered_by": [
          "TC-002"
        ]
      }
    ]
  },
  "tests": [
    {
      "draft_id": "TC-001",
      "title": "OKR admin configures custom fields and exports configuration to CSV for audit",
      "linked_requirement_keys": [
        "DEMO-4522"
      ],
      "linked_ac_ids": [
        "AC-01"
      ],
      "execution_tier": "P1",
      "test_pattern": "journey",
      "role": "OKR_ADMIN",
      "customer_impact": "Admins cannot bulk-export field data; migration and audits are blocked.",
      "deferrable": false,
      "test_data_required": true,
      "test_data_prerequisites": "Staging tenant with at least two OKR custom fields and sample OKR records.",
      "test_type": "Manual",
      "priority": "High",
      "priority_score": {
        "customer_harm": 4,
        "likelihood": 3,
        "coverage_criticality": 4,
        "automation_value": 3,
        "total": 11,
        "derived_tier": "P1",
        "rationale": "Primary admin audit/export workflow; AC-01 happy path. Harm is high for compliance, likelihood moderate on a stable settings surface."
      },
      "preconditions": "User has OKR admin role; feature flag for CSV export enabled on staging.",
      "automation_fit": "partial",
      "automation_candidate": true,
      "automation_blockers": [
        "file_download_assertion",
        "spreadsheet_parse_in_ci"
      ],
      "persona_notes": {
        "qa_engineer": "Covers admin export happy path from settings through file validation — primary AC-01 revenue/audit path.",
        "test_architect": "Single journey spans configuration UI and export artifact; avoids separate atomic export click test.",
        "automation_engineer": "API setup for fields + UI export trigger; file content check may stay manual or use fixture parser."
      },
      "steps": [
        {
          "step": "Open **Settings → OKR → Custom fields** and confirm existing fields list loads.",
          "expected_result": "Table shows field name, type, and used-in columns for at least two fields."
        },
        {
          "step": "Open one field detail and note name and type for later CSV comparison.",
          "expected_result": "Detail panel matches list row values."
        },
        {
          "step": "Choose **Export CSV** from settings toolbar.",
          "expected_result": "Export starts without permission error; progress or download prompt appears."
        },
        {
          "step": "Download the file and open in a spreadsheet tool.",
          "expected_result": "CSV header includes field name, type, and applicable goal type columns per AC-01."
        },
        {
          "step": "Locate the field from step 2 in the CSV.",
          "expected_result": "Row values match UI name and type."
        }
      ],
      "tags": [
        "export",
        "journey",
        "demo"
      ],
      "source_quotes": [
        "Admins can export custom field definitions to CSV for audit."
      ]
    },
    {
      "draft_id": "TC-002",
      "title": "Standard user completes OKR workflow but cannot export or edit field configuration",
      "linked_requirement_keys": [
        "DEMO-4522"
      ],
      "linked_ac_ids": [
        "AC-02"
      ],
      "execution_tier": "P1",
      "test_pattern": "journey",
      "role": "STANDARD_USER",
      "customer_impact": "Unauthorized users could exfiltrate configuration or change global field setup if RBAC fails.",
      "deferrable": false,
      "test_data_required": true,
      "test_data_prerequisites": "Standard user with access to OKR overview; at least one OKR visible; no admin rights.",
      "test_type": "Manual",
      "priority": "High",
      "priority_score": {
        "customer_harm": 5,
        "likelihood": 3,
        "coverage_criticality": 4,
        "automation_value": 4,
        "total": 12,
        "derived_tier": "P1",